{
  "$schema": "https://json-schema.org/draft/2020-12/schema",
  "title": "ProblemSpec",
  "type": "object",
  "required": [
    "goal",
    "scope",
    "constraints",
    "acceptance_criteria",
    "assumptions"
  ],
  "properties": {
    "protocol_version": {
      "type": "string",
      "pattern": "^[0-9]+\\.[0-9]+$"
    },
    "goal": {
      "type": "string",
      "minLength": 1
    },
    "scope": {
      "type": "object",
      "required": [
        "in",
        "out"
      ],
      "properties": {
        "in": {
          "type": "array",
          "items": {
            "type": "string"
          }
        },
        "out": {
          "type": "array",
          "items": {
            "type": "string"
          }
        }
      },
      "additionalProperties": false
    },
    "constraints": {
      "type": "array",
      "items": {
        "type": "string"
      }
    },
    "acceptance_criteria": {
      "type": "array",
      "items": {
        "type": "string"
      }
    },
    "assumptions": {
      "type": "array",
      "items": {
        "type": "string"
      }
    }
  },
  "additionalProperties": false
}
